;ComplaintType;Complaint;Date;Decision;Report_name;PrimaryKey
4089;Press and Defamation;Complaint of Shri Haji Usmangani Rizvi. President, Amin-e-Shariat, Education Trust, Jamnagar, Gujarat against The Week, Cochin;November 17, 2003;Directions to publish rebuttal;AnnualReport2004;4089
4095;Press and Defamation;Complaint of Shri H.L. Srikanthaiah, Minister for Revenue, Government of Karnataka, Bangalore against Hai Bangalore;March 17, 2004;Withdrawn as settled;AnnualReport2004;4095
4096;Press and Defamation;Complaint of Shri Basavangouda Patil, Minister of Textiles against Hai Bangalore;March 17, 2004;Withdrawn as settled;AnnualReport2004;4096
4097;Press and Defamation;Complaint of Smt. Motamma, Minister for Women & Children Welfare, Government of Karnataka, Bangalore against Hai Bangalore;March 17, 2004;Withdrawn as settled;AnnualReport2004;4097
4098;Press and Defamation;Complaint of Shri K.B. Koliwad, Minister for Rural Water Supply, Government of Karnataka, Bangalore against Hai Bangalore;March 17, 2004;Withdrawn as settled;AnnualReport2004;4098
4099;Press and Defamation;Complaint of Shri B. Srikantappa, Superintendent of Police, Haveri against Hai Bangalore;March 17, 2004;Admonished;AnnualReport2004;4099
4100;Press and Defamation;Complaint of Shri P.M. Pemmaiah, Assistant Commissioner of Police, Ulsoor Gate Sub Division, Bangalore against Hai Bangalore;March 17, 2004;Admonished;AnnualReport2004;4100
4101;Press and Defamation;Complaint of Shri Radhakrishna, Bangalore against Hai Bangalore;March 17, 2004;Admonished;AnnualReport2004;4101
4102;Press and Defamation;Complaint of Shri Suresh Naidu, ACP, Madivala Sub Division against Hai Bangalore;March 17, 2004;Admonished;AnnualReport2004;4102
4103;Press and Defamation;Complaint of Shri S.D. Siddalinga Swamy, Executive Director, HMT Watch Division, Bangalore against Hai Bangalore;March 17,2004;Withdrawn as settled;AnnualReport2004;4103
4104;Press and Defamation;Complaint of Shri R.B. Deshpande, Belgaum, Karnataka against Hai Bangalore;March 17,2004;Directions to publish clarification;AnnualReport2004;4104
4105;Press and Defamation;Complaint of Shri Ravindranath Tagore, IPS, Inspector General of Police, Central Range, Bangalore against Hai Bangalore;March 17,2004;Dismissed being sub-judice;AnnualReport2004;4105
4106;Press and Defamation;Complaint of the Chairman, Ayurveda Vidyalaya Samiti, Bijapur against Bangalore, Bangalore;March 17,2004;Admonished;AnnualReport2004;4106
4110;Press and Defamation;Complaint of Shri K.K. Naik. Shri Satya Sai Education Association, Prijapur, Karnataka against Kannda Kogile;March 17,2004;Disposed of with directions;AnnualReport2004;4110
4111;Press and Defamation;Complaint of Shri Mohd. Isac, Kundapura, Karnataka against Kunda Prabha, Kundapura;March 17,2004;Disposed of;AnnualReport2004;4111
4119;Press and Defamation;Complaint of Shri S.A. Abdul Salam, Kerala against Madhyamam, Kozhikode, Kerala;March 17,2004;Dismissed;AnnualReport2004;4119
4120;Press and Defamation;Complaint of Shri Pratap Ramdas, Manager, Tata Tea Ltd., Kerala against Madhyamam. Kozhikode, Kerala;March 17,2004;Cautioned;AnnualReport2004;4120
4121;Press and Defamation;Complaint of Shri R. Raveendran, Advocate, Kerala against Crime, Kozhikode, Kerala;March 17,2004;Disposed of with directions;AnnualReport2004;4121
4126;Press and Defamation;Complaint of Smt. Abhilasha Bisht, IPS, S.P. Cuddapah, Andhra Pradesh against Vartha, Cuddapa, Andhra Pradesh;March 17, 2004;Directions;AnnualReport2004;4126
4130;Press and Defamation;Complaint of Shri S.K. Das, S.E. (Excv.) Chandrapur, Maharashtra against Vidharbh Chandika, Nagpur, Maharashtra;March 17, 2004;Upheld;AnnualReport2004;4130
4145;Press and Defamation;Complaint of Laureate Education Society, Bharari Shimla, H.P. against Divya Himachal, Shimla;March 17, 2004;Warned;AnnualReport2004;4145
4146;Press and Defamation;Complaint of Shri Harbans Singh, Executive Engineer, Kathua, J&K against Glimpses of Future, Jammu;March 17, 2004;Directions;AnnualReport2004;4146
4148;Press and Defamation;Complaint of Shri Subhash Chander Jain, Ghaziabad against Sankalp, Ghaziabad;March 17, 2004;Directions;AnnualReport2004;4148
4180;Press and Defamation;Complaint of Dr. Sadasukhi Soni, Katni, M.P. against Navbharat, Jabalpur;DirectionsMarch;Dismissed;AnnualReport2004;4180
4189;Communal, Casteist and Anti-National Writings;Complaint of Dr. Shujaat Vali, Lara Mother Health Care Centre, Godhra, Gujarat against Sandesh;June 30, 2003;Censured;AnnualReport2004;4189
4190;Communal, Casteist and Anti-National Writings;Complaint of Shri Usman Haji Ahmed Qurayshi, General Secretary, Forum for Social Justice, Ahmedabad against Sandesh;June 30, 2003;Censured;AnnualReport2004;4190
4192;Communal, Casteist and Anti-National Writings;Complaint of Shri Shahabuddin, President, All India Muslim Majliees-E-Mushwarat, New Delhi against Sandesh;June 30, 2003;Censured;AnnualReport2004;4192
4193;Communal, Casteist and Anti-National Writings;Complaint of Dr. Shakeel Ahmad, Administrator, IRCG-Cell for Legal Help and Guidance, Ahmedabad against Sandesh;June 30, 2003;Censured;AnnualReport2004;4193
4195;Communal, Casteist and Anti-National Writings;Memorandum from Citizens of Ahmedabad regarding spreading of violence through print media in Gujarat against Sandesh;June 30, 2003;Censured;AnnualReport2004;4195
4196;Communal, Casteist and Anti-National Writings;Objectionable clippings relating to Gujarat riots for suo-motu action against Vishva Hindu Samachar, Hindustan Times, Dainik Jagran, The Telegraph, Asian Age, Rashtriya Sahara and The Mainstream;June30, 2003;Disposed of with observations;AnnualReport2004;4196
4197;Communal, Casteist and Anti-National Writings;Reference from an anonymous complainant regarding publication of an objectionable photograph in The Hindustan Times, New Delhi;June30, 2003;Disposed of with observations;AnnualReport2004;4197
4199;Communal, Casteist and Anti-National Writings;Complaint of Maj. General Don Patrick (Retired) Ooty, Tamil Nadu against Hindu.;June30, 2003;Amends made;AnnualReport2004;4199
4212;Communal, Casteist and Anti-National Writings;Complaint of Shri B. Sultan Abdul Khader, Pondicherry against Junior Vikalan, Chennai;March17, 2004;Dismissed;AnnualReport2004;4212
4213;Communal, Casteist and Anti-National Writings;Complaint of Shri Syed Anwar and Others resident of Kortala representing Muslim Community, Andhra Pradesh against Eenadu;March17, 2004;Dismissed;AnnualReport2004;4213
4214;Press and Morality;Complaint of Ms. Chitra Phuloria, New Delhi against Femina, Mumbai;September 22, 2003;Warned;AnnualReport2004;4214
4216;Press and Morality;Suo-motu action against The Hindustan Times New Delhi for publication of classified advertisements of health/physical fitness services using undignified languages, indicative of covert soliciting;September 22, 2003;Closed in view of corrective steps;AnnualReport2004;4216
4217;Press and Morality;Suo-motu action against The Times of India, New Delhi for publication of classified advertisements of health/physical fitness services using undignified languages, indicative of covert soliciting;September 22, 2003;Advise;AnnualReport2004;4217
4218;Press and Morality;Complaint of Shri Neelkanth Paratkar, General Secretary, The Brihanmumbai Union of Journalists, Mumbai against Mid Day, Mumbai;November 17, 2003;Reprimanded;AnnualReport2004;4218
4219;Press and Morality;Complaint of Shri K.S. Ubale, Vice-President, Grahak Panchayat, Nagpur against Daily Loksatta, Nagpur, Maharashtra;November 17, 2003;Observations;AnnualReport2004;4219
4220;Press and Morality;Complaint of Shri K.K.V. Kurup, Mumbai against Mid Day, Mumbai;March 17, 2004;Disposed of being sub-judice;AnnualReport2004;4220
4221;Press and Morality;Complaint of Ms. Jyotsana Chatterji, Director, Joint Women Programme, New Delhi against Outlook;March 17, 2004;Admonished;AnnualReport2004;4221
4224;Principles and Publications;Complaint of Smt. S. Bhalla, Principal, Maitreyi College, N.D. against Hindustan, N.D.;June 30, 1993;Contradiction published-No action;AnnualReport1994;4224
4227;Principles and Publications;Complaint of Sh. B.K. Tiwari, Execu-tive Editor, 'Deshbandhu', Raipur against Navabharat, Raipur M.P.;June 30, 1993;Observations (guidelines reiterated);AnnualReport1994;4227
4229;Principles and Publications;Complaint of the Director, ICAT, Govt. of Tripura, Agartala against Dainik Sambad, Agartala.;June 30, 1993;Dismissed as withdrawn;AnnualReport1994;4229
4230;Principles and Publications;Complaint of Sh. P.R. Meena, DCP, Central Zone, Delhi Police, against Rashtriya Sahara, N.D.;June 30, 1993;Disposed with observations;AnnualReport1994;4230
4244;Principles and Publications;Complaint of Sh. Pradeep Kumar Jain, Sri Panchayati Gaushala, Hapur, U.P. against Amar Ujala, Meerut.;January 24, 1994;Settlement;AnnualReport1994;4244
4245;Principles and Publications;Complaint of Nakkeeran, Tamil week-ly, Madras against India Today, Tamil and English editions, New Delhi.;January 24, 1994;Disposed;AnnualReport1994;4245
4255;Principles and Publications;Complaint of the Secretary, Krishi Export Commercial Corporation, Varanasi against Samachar Jyoti, Varasani.;January 24, 1994;Disposed with observations;AnnualReport1994;4255
4258;Principles and Publications;Complaint of Sh. V. Ramananda Sarma, Madras against Sunday-English weekly, Calcutta.;March 28, 1994;Dismissed;AnnualReport1994;4258
4259;Principles and Publications;Complaint of Sh. Kailash Madvaiya, General Secretary, All India Bun-delkhand Sahiyta and Sanskrit Council, Bhopal against Dainik Orchha Times of Tikamgarh.;March 28, 1994;Respondent agrees to publish rejoinder;AnnualReport1994;4259
4266;Communal, Casteist and Anti-National Writings;Complaint of Deputy Director (Liaison), Army Welfare Housing Organisation, New Delhi against I.E., Chandigarh.;March 28, 1994;Rejoinder directed;AnnualReport1994;4266
4270;Communal, Casteist and Anti-National Writings;Complaint of Sh. Niranjanlal Shar-ma against Bahujan Sangharsh, Delhi.;June 30, 1993;Upheld (censured);AnnualReport1994;4270
4271;Communal, Casteist and Anti-National Writings;Complaint of Bharatiya Lekhak Patrakar Sangh, Bombay against Bahujan Sangharsh, Delhi.;June 30, 1993;Upheld (censured);AnnualReport1994;4271
4274;Communal, Casteist and Anti-National Writings;Complaint of President, Dr. Ambedkar Seva Samiti and 24 others, Rajnandgaon against Nandgaon Times, Rajnandgaon (M.Ρ.);September 20, 1993;Censured;AnnualReport1994;4274
4295;Press and Defamation;Complaint of Sh. Ram Kripal against Editor Swatantra Chetna, Lucknow.;June 30, 1993;Censured;AnnualReport1994;4295
4301;Press and Defamation;Complaint of Pt. Prithviraj Dwivedi, Editor, Trikal Jyoti, Balotara against Long Post, Balotara.;June 30, 1993;Dismissed-out-side charter;AnnualReport1994;4301
4302;Press and Defamation;Complaint of Pt. Prithviraj Dwivedi, Editor, Trikal Jyoti, Balotara against Marichika, Balotara.;June 30, 1993;Dismissed-out-side charter;AnnualReport1994;4302
4304;Press and Defamation;Complaint of M/S Shankar Namkeen Bhandar, Saharanpur against Chhintay Aur Bouchharay, Saharanpur, U.P.;June 30, 1993;Upheld (Censured);AnnualReport1994;4304
4305;Press and Defamation;Complaint of M/s. Shankar Namkeen Bhandar Saharanpur against Chhintay Aur Boucharay, Saharanpur, U.P.;June 30, 1993;Censured;AnnualReport1994;4305
4306;Press and Defamation;Complaint of M/s. Shankar Namkeen Bhandar Saharanpur against Chhintay Aur Boucharay, Saharanpur, U.P.;June 30, 1993;Censured;AnnualReport1994;4306
4307;Press and Defamation;Complaint of Sh. H.P. Gaur, Factory Manager, Star Paper Mills Ltd., Saharanpur against Chhintay Aur Bouchharay, Saharanpur.;June 30, 1993;Censured;AnnualReport1994;4307
4308;Press and Defamation;Complaint of Indian Institute of Tech-nology, Kanpur against Amar Ujala, Kanpur, U.P.;June 30, 1993;Censured;AnnualReport1994;4308
4309;Press and Defamation;Complaint of Manager, Janata Janar-dan Inter College, Muzaffarnagar, against Amar Ujala, Meerut, U.P.;June 30, 1993;Disposed with Observations;AnnualReport1994;4309
4311;Press and Defamation;Complaint of Sh. Shankar Lal Saini Managing Director, Saini News Ser-vice, Sardarshahr (Rajasthan) against Rashtradoot, Jaipur (Raj.);June 30, 1993;Disposed with Observations;AnnualReport1994;4311
4329;Press and Defamation;Complaint of Dr. P.S. Jain against I.E., New Delhi.;September 20, 1993;Dismissed;AnnualReport1994;4329
4335;Press and Defamation;Complaint of G.M., Ordnance Factory, Hazaratpur (Tundla) against Hindi weekly, Brij Samrat.;September 20, 1993;Warned;AnnualReport1994;4335
4344;Press and Defamation;Complaint of Km. Ruchi Singh of Al-lahabad against Aaj, Allahabad edi-tion.;September 20, 1993;Warned;AnnualReport1994;4344
4346;Press and Defamation;Complaint of Sh. Rajni Ranjan Prasad, DM, Katihar (Bihar) against Aaj, Patna.;September 20, 1993;Contradiction directed;AnnualReport1994;4346
4356;Press and Defamation;Complaint of Sh. Satpal Singh Chhabra of Saharanpur against Saharanpur Darshan of Saharanpur.;September  20, 1993;Warned;AnnualReport1994;4356
4359;Press and Defamation;Complaint of Sh. Kailash Chandra Shah against;Nav Bharat Times.;Despleasure Expressed;AnnualReport1994;4359
4361;Press and Defamation;Complaint of Indian Institute of Tech-nology, Kanpur against Amar Ujala, Kanpur.;January 24, 1994;Contradiction directed;AnnualReport1994;4361
4366;Press and Defamation;Complaint of Sh. Subhash Sharma, IAS, Chief Secretary, Govt. of Pon-dicherry against Union Territory Inde-pendent, English Fortnighly, N.D.;Settled;Settled;AnnualReport1994;4366
4367;Press and Defamation;Complaint of Sh. Satpal Singh Chhabra of Saharanpur against Saharanpur Darshan of Saharanpur.;Settled;Warned;AnnualReport1994;4367
4371;Press and Defamation;Complaint of Indian Institute of Tech-nology, Kanpur against Amar Ujala, Kanpur.;Settled;Contradiction directed;AnnualReport1994;4371
4378;Press and Defamation;Complaint of Ms. Anuja Gupta and Sh. Jagdish Bhardwaje, AIDS Bhedbhav Virodhi Andolan, N.D. against Sunday, Calcutta.;January 24, 1994;Settled;AnnualReport1994;4378
4381;Press and Defamation;Complaint of Dr. Pushpendra Sharma, Patlawad against Langoti Swar, Hindi weekly, Patlawad, M.P.;January 24, 1994;Censured;AnnualReport1994;4381
4389;Press and Defamation;Complaint of Chairman, New Phaltan Sugar Works Ltd., Satara (Mah.) against Loksatta, Pune.;January 24, 1994;Rejoinder directed;AnnualReport1994;4389
4398;Press and Defamation;Complaint of Sh. Noor-Ul-Hassan, Journalist of Guna (M.P.) against Jan-satta, N.D.;January 24, 1994;Version directed;AnnualReport1994;4398
4405;Press and Defamation;Complaint of Smt. K. Sobha against Andhra Bhoomi Telugu daily of A.P.;March 28, 1994;Dismissed;AnnualReport1994;4405
4408;Press and Defamation;Complaint of Sh. K. Narayana, Police Constable Chikmagalur against Galcya.;March 28, 1994;Settled;AnnualReport1994;4408
4417;Press and Defamation;Complaint of the President, IMA Branch, Guna, M.P. against Jansatta, N.D.;March 28, 1994;Warned;AnnualReport1994;4417
4418;Press and Defamation;Complaint of Sh. M.L. Verma, District Agriculture Officer, Sitapur against Jagpahiya, Hindi weekly of Sitapur.;March 28, 1994;Disposed with observations;AnnualReport1994;4418
4422;Press and Defamation;Complaint of Sh. Shailandra Kumar, Sr. Personnel Officer, North Eastern Railway, Gorakhpur against Dainik Swatantra Chetna, Gorakhpur.;March 28, 1994;Rejoinder directed;AnnualReport1994;4422
4426;Press and Defamation;Complaint of Sh. Nahar Singh Yadav, Advocate and National General Secretary, Samajvadi Yuva Jan Sabha against Dainik Hint, Ghaziabad.;March 28, 1994;Editor offers to publish complainant's version-matter closed;AnnualReport1994;4426
4427;Press and Defamation;Complaint of Sh. A.L. Sirpaul, N.D. against Rashtriya Sahara, N.D.;March 28, 1994;Partly upheld;AnnualReport1994;4427
4444;Principles and Publication;Complaint of Shri Ravi Gupta, Journalist, Chhattarpur, M.P. against Chhattarpur Bhramar, Chhatarpur, M.P;.February 9, 2006;Censured;AnnualReport2006;4444
4447;Press and Defamation;Complaint of Dr. Om Prakash Bhandari and Smt. Radha Bhandari, Chittorgarh, Rajasthan against Surya Rath, Chittorgarh, Rajasthan.;June 28, 2005;Censured;AnnualReport2006;4447
4473;Press and Defamation;Complaint of Shri Jagdish Sewalani, M/s Vishnu Agency, Marwar Junction, Pali-Marwar (Rajasthan) against Garib Sathi, Jodhpur, Rajasthan. ’’;October 7, 2005;Censured;AnnualReport2006;4473
4479;Press and Defamation;Complaint of Dr. (Mrs.) Kusum Sharma, Medical Women Hospital, Bharatpur, Rajasthan against Lal Nishan, Bharatpur, Rajasthan. ’’;October 7, 2005;Admonished;AnnualReport2006;4479
4480;Press and Defamation;Complaint of Ms. Indu Chadha, Principal, Government College, Gurgaon, Haryana against Hindustan, New Delhi. ’’;October 7, 2005;Censured;AnnualReport2006;4480
4481;Press and Defamation;Complaint of Ms. Indu Chadha, Principal, Government College, Gurgaon, M Haryana against Amar Ujala, Noida, U.P. ’’;October 7, 2005;Directions;AnnualReport2006;4481
4485;Press and Defamation;Complaint of Dr. N.K. Rai, Joint Director, Institute of Human Behaviour & Allied Sciences, Delhi against Sabki Khabar, Delhi. ’’ Disposed of;October 7, 2005;with directions;AnnualReport2006;4485
4487;Press and Defamation;Complaint of Shri K. Raghava Reddy, G.M. Medinova Diagnostic Services Ltd. and Shri J.A. Kumara Swamy, Marketing Manager, Medinova Diagnostic Services Ltd., Bangalore against Agni Idhu Pathrikeyalla Prathibhataneya Astra, Bangalore. ’’ Dismissed in;October 7, 2005;default;AnnualReport2006;4487
4491;Press and Defamation;Complaint of The Assistant Regional Transport Officer (Administration) Sultanpur, U.P. against Dainik Jagran, Kanpur, U.P. ’’;October 7, 2005;Dismissed;AnnualReport2006;4491
4492;Press and Defamation;Complaint of Shri Bharat Bhushan Bansal, Proprietor, M/s Ramlal Chandanlal,  Muzaffarnagar, U.P. against Amar Ujala, Meerut, U.P.;October 7, 2005;Directions;AnnualReport2006;4492
4493;Press and Defamation;Complaint of Shri Mehboob Ali, M.L.A., Former State Minister of Waqf, Amroha, U.P. against Amar Ujala, Moradabad, U.P. ’’;October 7, 2005;Dismissed;AnnualReport2006;4493
4500;Press and Defamation;Complaint of M/s Shahi Export House, Faridabad, Haryana against ‘‘Bigul’’, Lucknow, U.P. ’’;October 7, 2005;Warned;AnnualReport2006;4500
4502;Press and Defamation;Complaint of Dr. Bimal Kundu, Hooghly, West Bengal against Mafaswal Bani, Hooghly, West Bengal;October 7, 2005;Warned;AnnualReport2006;4502
4511;Press and Defamation;Complaint of Shri R. Raghu, Chairman, Karnataka Exhibition Authority, Mysore against Andholan Dinapatrike, Mysore.;October 7, 2005;Dismissed;AnnualReport2006;4511
4513;Press and Defamation;;84.Complaint of Shri P.R. Ramesh, Mayor, Bangalore City Corporation, Bangalore,;Karnataka against The Times of India, Bangalore. ’’ Dismissed;AnnualReport2006;4513
4514;Press and Defamation;Complaint of Shri P.R. Ramesh,;Mayor, Bangalore City Corporation, Bangalore, Karnataka against Vijay;Karnataka, Bangalore. ’’ Dismissed;AnnualReport2006;4514
4515;Press and Defamation;Complaint of Shri N.R. Jagadesh, Chairman Sarvodaya Trust, Tumkur, Karnataka against Hai Bangalore, Bangalore. ’’;Mayor, Bangalore City Corporation, Bangalore, Karnataka against Vijay;Warned;AnnualReport2006;4515
4516;Press and Defamation;Complaint of Shri Prakash Tapa Shetty, Chairman, Basaveshwara Co-operative Bank, Bagalkot, Karnataka against Hai Bangalore, Bangalore. ’’;Mayor, Bangalore City Corporation, Bangalore, Karnataka against Vijay;Withdrawn;AnnualReport2006;4516
4518;Press and Defamation;Complaint of The Managing Director, A.P. State Warehousing Corporation, Hyderabad against Vartha, Vijayawada, Andhra Pradesh ’’;Mayor, Bangalore City Corporation, Bangalore, Karnataka against Vijay;Censured;AnnualReport2006;4518
4519;Press and Defamation;Complaint of Shri Ramoji Rao, Chief of Eenadu Group of Companies and General Manager of Ramoji Film City, Hyderabad, Andhra Pradesh against Vartha, Hyderabad. ’’;Mayor, Bangalore City Corporation, Bangalore, Karnataka against Vijay;Admonished.;AnnualReport2006;4519
4521;Press and Defamation;Complaint of Shri K. Rama Krishna, Vijayawada, A.P. against Andhra Jyoti, Vijaywada, Andhra Pradesh. ’’ Disposed of;October  7, 2005;with directions;AnnualReport2006;4521
4522;Press and Defamation;Complaint of Shri K. Rama Krishna, Vijayawada, A.P. against Eenadu, Vijayawada, Andhra Pradesh. ’’ Disposed of;October  7, 2005;with directions;AnnualReport2006;4522
4524;Press and Defamation;Complaint of Shri G.M. Joseph Raj, Principal, St. Antony's Matriculation and Higher Secondary School, Chennai against Dinamalar, Chennai. ’’ Dismissed being;October  7, 2005;devoid of merit;AnnualReport2006;4524
4525;Press and Defamation;Complaint of Shri K.M. Kurian, Commercial Manager, M/s Air India Ltd., Cochin, Kerala against Kerala Mid Day Times, Kochi, Kerala. ’’;October  7, 2005;Closed;AnnualReport2006;4525
4528;Press and Defamation;Complaint of Manager Secretary, Sandila Girl's Intermediate College, Sandila, Hardoi, Uttar Pradesh against Hindustan, Lucknow, U.P. ’’;February 9, 2006;Reprimanded;AnnualReport2006;4528
4530;Press and Defamation;Complaint of Shri L.P. Sinha, Managing Director, Bihar State Hydroelectric power Corporation, Patna against Prabhat Khabar, Patna.;February 9, 2006;Upheld;AnnualReport2006;4530
4531;Press and Defamation;Complaint of Shri Vijay Kumar Sinha, Patna against Aj, Patna. ’’ Offers to publish;February 9, 2006;clarification;AnnualReport2006;4531
4534;Press and Defamation;Complaint of Shri Vijay Kumar Sinha, Patna against Hindustan. ’’ offers to publish;February 9, 2006;clarification;AnnualReport2006;4534
4538;Press and Defamation;Complaint of Shri Ravinder Dwivedi, National President, Bhrastachar Nirmulan Samiti, Thane against Janambhoomi. ’’;February 9, 2006;Dismissed;AnnualReport2006;4538
4549;Press and Defamation;Complaint of Shri I. Venkateshwarulu IAS, Managing Director, A.P. State Warehousing Corporation, Hyderabad against Eenadu, Hyderabad.;February 9, 2006;Dismissed-not pursued;AnnualReport2006;4549
4551;Press and Defamation;Complaint of Shri S.A. Rahim, Chairman, Participatory Employment Net, (PEN-INDIA) Mehboobnagar, Andhra Pradesh against Vartha, Hyderabad. ’’ Dismissed-not;February 9, 2006;pursued;AnnualReport2006;4551
4554;Press and Defamation;Complaint of Mrs. Indira, Kottivakkam, Chennai against Dinamalar. ’’ Dismissed-not;February 9, 2006;pursued;AnnualReport2006;4554
4555;Press and Defamation;Complaint of Mrs. Indira, Kottivakkam, Chennai against Daily Thanthi. ’’ Dismissed-not;February 9, 2006;pursued;AnnualReport2006;4555
4556;Press and Defamation;Complaint of Mrs. Indira, Kottivakkam, Chennai against Dhinamani, Chennai. ’’ Dismissed-not;February 9, 2006;pursued;AnnualReport2006;4556
4557;Press and Defamation;Complaint of Prof. Dr. S. Jaishankar, MD.,  D.M. (CARD) Nizams Institute of Medical Sciences, Punjagutta, Hyderabad, Andhra Pradesh against Eenadu, Hyderabad, Andhra Pradesh. ’’;February 9, 2006;Dismissed;AnnualReport2006;4557
4558;Press and Defamation;Complaint of S/Shri Rajpal Singh, Property Dealer, Geeta Colony, Delhi and Harish Rastogi, Gold Jewellery Dealer, Delhi against Punjab Kesari, Delhi. ’’;February 9, 2006;Warned;AnnualReport2006;4558
4560;Press and Defamation;Complaint of Ms. CTM Suguna, IAS Collector and DM, Mayurbhanj, Orissa against Dharitri, Bhubaneswar.;February 9, 2006;Reprimanded;AnnualReport2006;4560
4561;Press and Defamation;Complaint of Ms. CTM Suguna, IAS,;Collector and DM, Mayurbhanj, Orissa against Dharitri, Bhubaneswar.;’’ Reprimanded;AnnualReport2006;4561
4562;Press and Defamation;Complaint of Ms. Swarnali Brohmo Choudhary, Bongaigaun, Assam against Dainik Agradoot, Guwahati. ’’;Collector and DM, Mayurbhanj, Orissa against Dharitri, Bhubaneswar.;Censured;AnnualReport2006;4562
4563;Press and Defamation;Complaint of Ms. Swarnali Brohmo Choudhary, Bongaigaun, Assam against Aaji, Guwahati. ’’;Collector and DM, Mayurbhanj, Orissa against Dharitri, Bhubaneswar.;Censured;AnnualReport2006;4563
4568;Press and Defamation;Complaint of Shri Kolagani Apparao, Secretary, Human Rights Council, Visakhapatnam, Andhra Pradesh against Eenadu, Hyderabad. ’’ Disposed of;Collector and DM, Mayurbhanj, Orissa against Dharitri, Bhubaneswar.;;AnnualReport2006;4568
4574;Press and Morality;Complaint of Shri P.K. Dhande, Indore M.P. against Grih Sobha, New Delhi.;October 7, 2005;No further action;AnnualReport2006;4574
4582;Press and Morality;Complaint of Ms. Pramodini Pradhan, Secretary, People's Union for Civil Liberties, (PUCL) Bhubaneswar, Orissa against Dharitri, Bhubaneshwar.;February 9, 2006;Upheld;AnnualReport2006;4582
4586;Principles and Publications;Complaint of Shri Rohit Yadav, Journalist, Rewari against Punjab Kesari, New Delhi.;January 24, 2003;Dismissed;AnnualReport2003;4586
4587;Principles and Publications;Complaint of Mrs. M. Titus, Principal, Air Force Bal;Bharati School, New Delhi against The Hindustan Times, New Delhi.;Directions to publish rejoinder;AnnualReport2003;4587
4588;Principles and Publications;Complaint of Dr. Shivcharan Yadav, Executive Member, Narnaul against Dainik Punjab Kesari, New Delhi.;Bharati School, New Delhi against The Hindustan Times, New Delhi.;Cautioned;AnnualReport2003;4588
4626;Press and Defamation;Complaint of Shri Umashankar Gupt, Kanpur against Amar Ujala, Kanpur.;October 7, 2002;Sub-judice;AnnualReport2003;4626
4630;Press and Defamation;Complaint of Shri Bijay Khaitan, Varanasi against Gandiv, Varanasi.;October7,2002;Disposed with observations;AnnualReport2003;4630
4640;Press and Defamation;Complaint of Shri Bhajan Singh. Α.Ε.Ο. of Education Department, U.T. Administration, Chandigarh against Chandigarh Bhaskar, Chandigarh.;October 7,2002;Directions to publish clarification;AnnualReport2003;4640
