;ComplaintType;Complaint;Date;Decision;Report_name;PrimaryKey
2782;Principles and Publications;Complaint of Mr. Justice P. Kodan-da Ramayya, Chairman, Special Court, AP Land Grabing (Prohibi-tion) Act, Hyderabad against Andhra Prabha, Hyderabad;September 9, 1992;Rejected with observation;AnnualReport1993;2782
2785;Principles and Publications;Complaint of Mr. Pablo Bar-tholomew, photographer against 'Sunday' Calcutta;September 9, 1992;upheld;AnnualReport1993;2785
2799;Principles and Publications;Complaint of M/s. Usha Rectifier against against Dalal Street Journal, Bombay;March 31, 1993;Upheld (Displeasure);AnnualReport1993;2799
2800;Principles and Publications;Complaint of Sh. G.N. Sharma against Mid-day, Bombay;March 31, 1993;Publication of clarification directed;AnnualReport1993;2800
2804;Principles and Publications;Complaint of Sh.K.C John, Direc-tor, Institute of Journalism, Thiruvananthapuram Malayala Manorama against;March 31, 1993;Upheld (Displeasure);AnnualReport1993;2804
2805;Principles and Publications;Complaint of Sh.K.C John, Direc-tor, Institute of Journalism, Thiruvananthapuram against Kerala Kaumudi;March 31, 1993;Upheld (Displeasure);AnnualReport1993;2805
2806;Principles and Publications;Complaint of Sh. K.C John, Director Institute of Journalism, Thiruvananthapuram, against Mathrubhumi;March 31, 1993;Upheld (Displeasure);AnnualReport1993;2806
2808;Communal, Casteist and Anti-National Writings;Complaint of Sh. Zameer Ahmed Jumlana, Member, Indian Union Muslim League, Delhi against Jansatta, Delhi;June 22, 1992;Dismissed for non-prosecution with observation;AnnualReport1993;2808
2809;Communal, Casteist and Anti-National Writings;Complaint of Deputy Secretary (Home) Delhi Admn. against 'The Daily Pratap' New Delhi;September9, 1992;Border line case observations;AnnualReport1993;2809
2816;Communal, Casteist and Anti-National Writings;Complaint of Sh. R L Kain, General Secy. Dr. B. R. Ambedkar Vichar Manch, Delhi against TOI;March 31, 1993;Assurance;AnnualReport1993;2816
2819;Communal, Casteist and Anti-National Writings;Complaint of Sh. Mohinder Singh Chawla, Secretary, Gurudwara Singh Sabha, Kumardhubi Dhanbad against Janmat, Dhanbad;March 31, 1993;Publication of contradiction directed;AnnualReport1993;2819
2824;Press and Defamation;Complaint of Sh. D D Goyal, Com-mercial Department, M/s Driplex Water Engineering Ltd. against San-marg, Varanasi;June 22, 1992;Dismissed for Non-prosecution;AnnualReport1993;2824
2826;Press and Defamation;Complaint of Mrs. Manju Sharma, General Secretary, U.P. Congress Committee (1), Labour Cell, Muzaf-farnagar, U.P. against Dehat, Muzaffarnagar;June 22, 1992;Upheld (Censured);AnnualReport1993;2826
2832;Press and Defamation;Complaint of Sh. S. Venugopalan, Trustee Life Eternal Trust, Delhi against Sakal, Pune;June 22, 1992;Upheld (Censured);AnnualReport1993;2832
2833;Press and Defamation;Complaint of Sh. S Venugopalan, Trustee Life Eternal Trust, Delhi against Kesari, Pune;June 22, 1992;Clarification published;AnnualReport1993;2833
2834;Press and Defamation;Complaint of Sh. S. Venugopalan, Trustee Life Eternal Trust, Delhi against Aikya, Satara;June 22, 1992;Rejoinder directed-warned for non-compliance;AnnualReport1993;2834
2837;Press and Defamation;Complaint of Dr. Sukhpal Singh Verma against weekly Vidambana, Haridwar;June 22, 1992;Observations contradiction directed;AnnualReport1993;2837
2843;Press and Defamation;Complaint of Sh. Shankar Singh, Advocate against Jansatta Hindi daily of New Delhi;June 22, 1992;Sub-judice;AnnualReport1993;2843
2844;Press and Defamation;Complaint of Sh. G C Jain against Dainik Kalyug Darpan, Saharanpur, U.P.;June 22, 1992;Upheld (censured);AnnualReport1993;2844
2850;Press and Defamation;Complaint of Dr. Pushpa Jha against Daily Chautha Sansar, Indore;June 22, 1992;Upheld;AnnualReport1993;2850
2851;Press and Defamation;Complaint of Sh. K. Raju, President, Madurai Kamraj-Manomaniam Sundaranar University Teachers Association' Madurai against Dinamalar, Madurai;June 22, 1992;Contradiction directed;AnnualReport1993;2851
2856;Press and Defamation;Complaint of Shri Naresh Kumar Sharma c/o Shiv Diary against Doon Darpan, Dehradun;Sept 9, 1992;Contradiction directed;AnnualReport1993;2856
2863;Press and Defamation;Complaint of Sh. Shyam Aggarwal, Treasurer, Jan Adhikar Abhiyan, Delhi against Jansatta, New Delhi;September 9, 1992;Rejected;AnnualReport1993;2863
2867;Press and Defamation;Complaint of Sh. Mahendra Kumar, Proprietor, Shankar Namkeen Bhandar, Saharanpur against Dainik Sahkari Chintan' Saharan-pur, U.P.;September 9, 1992;Upheld (warned);AnnualReport1993;2867
2874;Press and Defamation;Complaint of Miss M Ambigapathi, Lecturer, Government College, Kumbakonam against Namadhu Kalugu Tamil Weckly of Madras;January 6, 1993;Upheld (censured);AnnualReport1993;2874
2878;Press and Defamation;Complaint of Sh. M A Hadi, Secretary, HEH The Nizam's Trust, Hyderabad against Sunday;January6, 1993;Upheld (warned);AnnualReport1993;2878
2883;Press and Defamation;Complaint of Sh. K. L. Meena against Amar Ujala, Meerut, U.P.;January 6, 1993;Upheld (warned);AnnualReport1993;2883
2888;Press and Defamation;Complaint of Sh. K. K. Arora, Vice-Chairman J N Educational Society, New Delhi against Jansatta, New Delhi;January 6, 1993;Upheld contradiction directed;AnnualReport1993;2888
2889;Press and Defamation;Complaint of Sh. K. K. Arora, Vice-Chairman J N Educational Society, New Delhi against Punjab Kesari, New Delhi;January 6, 1993;Upheld contradiction directed;AnnualReport1993;2889
2896;Press and Defamation;Complaint of Sh. Sita Ram Rajgar-hia against the Aaj, Patna;January 6, 1993;Upheld (Censured);AnnualReport1993;2896
2898;Press and Defamation;Complaint of Sh. Chandra Sarma, Joint Director, Soil Conservation Department, Guwahati against 'Mahanagar' Guwahati;January 6, 1993;Upheld (Censured);AnnualReport1993;2898
2901;Press and Defamation;Complaint of Sh. S. P. Gupta, Acting C&MD, Bongaigaon, Refinery & Petrochemicals Ltd., Assa against 'The News Front of Guwahati;January 6, 1993;Rejoinder directed;AnnualReport1993;2901
2913;Press and Defamation;Complaint of Deputy General Manager, Indian Ordnance Factory Katni against Hindi Weekly 'Shram Sudha' Katni, M.P.;January 6, 1993;Upheld (warned);AnnualReport1993;2913
2919;Press and Defamation;Complaint of Sh. Mohinder Singh Chawla, Secretary, Gurudwara Singh Sabha, Kumardhubi, Dhan-bad against Awaz, Dhanbad;March 31, 1993;Contradiction directed;AnnualReport1993;2919
2920;Press and Defamation;Complaint of Sh. Mohinder Singh Chawla, Secretary, Gurudwara Singh Sabha, Kumardhubi Dhanbad against Aaj, Dhanbad;March 31, 1993;Contradiction directed;AnnualReport1993;2920
2921;Press and Defamation;Complaint of the Secretary, Matru Sewa Sangh, Nagpur against Tarun Bharat, Nagpur;March 31, 1993;Contradiction directed;AnnualReport1993;2921
2923;Press and Defamation;Complaint of Sh. K. B. Sangappa, Head Constable, 56 Bellary District and Sh. K. Bheemappa, Head Con-stable, 23 Bellary District of Kar-nataka against Horaata, Karnataka;March 31, 1993;Rejected;AnnualReport1993;2923
2924;Press and Defamation;Complaint of Sh. K. B. Sangappa, Head Constable, 56 Bellary District and Sh. K Bheemappa, Head Con-stable, 23 Bellary District of Kar-nataka against Horaata, Karnataka;March 31, 1993;Rejected;AnnualReport1993;2924
2925;Press and Defamation;Complaint of Sh. K. B. Sangappa, Head Constable, 56 Bellary District and Sh. K Bheemappa, Head Constable, 23 Bellary District of Karnataka against Thungabhadra, Karnataka.;March 31, 1993;Rejected;AnnualReport1993;2925
2926;Press and Defamation;Complaint of Sh. K. B. Sangappa, Head Constable, 56 Bellary District and Sh. K Bheemappa, Head Constable, 23 Bellary District of Karnataka against Thungabhadra, Karnataka;March 31, 1993;Rejected;AnnualReport1993;2926
2927;Press and Defamation;Complaint of Sh. K. Natwar Singh against 'Sunday';March 31, 1993;Upheld (Censured);AnnualReport1993;2927
2930;Press and Defamation;Complaint of The President, Gondwana Samaj, Kanker, District Baster, M.P. against Sandesh, MP.;March 31, 1993;Rejected;AnnualReport1993;2930
2931;Press and Defamation;Complaint of The President, Gondwana Samaj, Kanker, District Bastar, M.P. against Deshbandhu, MP.;March 31, 1993;Rejected;AnnualReport1993;2931
2933;Press and Defamation;Complaint of Sh. S. S. Bisht, Manager, Garhwal Mandal Vikas Nigam Ltd., Garhwal against Chingari, Hindi daily of Bijnore, U.P.;March 31, 1993;Upheld (displeasure);AnnualReport1993;2933
2934;Press and Defamation;Complaint of Sh. D P Singh, Deputy Director, National Soil Con-servation (Agriculture) Directorate, Jhansi against Saptahik Swaran Dar-pan, Jhansi;March 31, 1993;Upheld (censured);AnnualReport1993;2934
2935;Press and Defamation;Complaint of Sh. D. P. Singh, Deputy Director, National Soil Conservation (Agriculture) Directorate, Jhansi against Lalit Brahman, Jhansi;March 31, 1993;Upheld (censured);AnnualReport1993;2935
2937;Press and Defamation;Complaint of Sh. Harbhajan Singh against Dilli ki Kalam, Delhi;March 31, 1993;Upheld (censured);AnnualReport1993;2937
2941;Press and Defamation;Complaint of Sh. M. C. Thomas against Swarthavesham weekly;March31, 1993;Upheld (warned);AnnualReport1993;2941
2945;Press and Morality;Complaint of Shri Dinesh Bhai Trivedi, MP (Rajya Sabha) against Sunday Statesmen Miscellany;March31, 1993;Observations;AnnualReport1993;2945
2946;Press and Morality;Publication of an allegedly obscene advertisement regarding kamasutra condom in Debonair issue of October 1991.;March31, 1993;Observations;AnnualReport1993;2946
2954;Principles and Publications;Complaint of Dr. K.N. Pandey, Works Manager/Admn. Ordance Factory Bhandara against Saptahik Mahila Vichar Manch, Bhandara.;June 2, 1998;Upheld (Admonished);AnnualReport1999;2954
2957;Principles and Publications;Complaint of Smt. Malati Shivashankar Pol, Assistant Director, Women & Child Welfare Department, Bellary against Bellary Sangarsha.;June 2, 1998;Dismissed not Pursued;AnnualReport1999;2957
2967;Principles and Publications;Complaint of Sh. V Sarma Rao, IAS, Commissioner of Social Welfare Department, Government of Andhra Pradesh, Hyderabad against Vaartha, Telugu daily.;June 2, 1998;Upheld (Directed to Publish Rejoinder).;AnnualReport1999;2967
2968;Principles and Publications;Complaint of Dr. Indira Murthy, Mumbai against Junior Science Refresher.;June 2, 1998;Settled (Offers to Remuneration-Proceedings Dropped).;AnnualReport1999;2968
2977;Principles and Publications;Complaint of Shri A Rashid Khan, Chennai against Daily Thanthi, Chennai.;Sandhya Satta Darshan, New Delhi.;Upheld;AnnualReport1999;2977
2979;Principles and Publications;Complaint of the General Secretary, Consumer's Assistance & Welfare Centre, Guntur (A.P.) against Eenadu, Telegu daily.;Sandhya Satta Darshan, New Delhi.;Upheld (Warned);AnnualReport1999;2979
2989;Principles and Publications;Complaint of Dr. H.K. Das, Director, Generic Engineering Unit & Professor, Centre for Biotechnology, Jawahark University, New Delhi aga Express, New Delhi. Nehru Mian;August 4, 1998;Upheld (Reprimanded);AnnualReport1999;2989
2995;Principles and Publications;Complaint of Sh. H.H. Kidwai, Sr. General Manager, Malvika Steel Ltd., Jagadishpur, District Sultanpur (U.P.) against Chetna Vichar Dhara, Lucknow.;August 4, 1998;Upheld (Censured);AnnualReport1999;2995
3004;Principles and Publications;Complaint of Ms. Hilary Pais,;Bangalore against India Today.;Upheld (Directions);AnnualReport1999;3004
3006;Principles and Publications;Complaint of Shri S S Kamath, Secretary, ICDS Ltd., Manipal (Karnataka) against Karavali Ale.;Bangalore against India Today.;Upheld;AnnualReport1999;3006
3013;Principles and Publications;Complaint of Shri Sunil Agnihotri, Sub-Editor, Dainik Bhaskar, Rewa, M.P. against Nav Sandesh, Satna.;October 5, 1998;No Substance;AnnualReport1999;3013
3016;Principles and Publications;Complaint of Mrs. Panna S Khatau, Mumbai against Sunday, Mid-Day.;December 1, 1998;Upheld (Admonished);AnnualReport1999;3016
3040;Press and Defamation;Complaint of Sh.Shivajirao Lomte, Advocate and Notary Public for Beed District against Marathwada Sathi.;June 2, 1998;Upheld (Directions);AnnualReport1999;3040
3047;Press and Defamation;Complaint of Sh. C Chennigappa, MLA, Bangalore against Hi Bangalore.;June 2, 1998;Upheld (Admonished);AnnualReport1999;3047
3055;Press and Defamation;Complaint of Sh. Mahabir Singh, Additional Deputy Commissioner of Police (Security), New Delhi against Public Asia.;August 4, 1998;Upheld (Censured);AnnualReport1999;3055
3057;Press and Defamation;Complaint of Sh. C.P. Rajendran, Trivandrum against Malayalam, Kochi.;August 4, 1998;Dismissed on merits.;AnnualReport1999;3057
3058;Press and Defamation;Complaint of Dr. S.E. Anjaneyulu, Manjary Nursing Home, Hyderabad against Eenadu.;August 4, 1998;Dismissed on merits.;AnnualReport1999;3058
3059;Press and Defamation;Complaint of Dr. S.E. Anjaneyulu, Manjary Nursing Home, Hyderabad against Vaartha.;August 4, 1998;Upheld (Reprimanded);AnnualReport1999;3059
3060;Press and Defamation;Complaint of General Manager, Telecommunications, Guntur against Demand, Guntur.;August 4, 1998;Upheld (Censured);AnnualReport1999;3060
3067;Press and Defamation;Complaint of Dr. Dinesh Chandra, Director, G.B. Pant Hospital, New Delhi against Jansatta, N.D.;August 4, 1998;Upheld (Reprimanded);AnnualReport1999;3067
3069;Press and Defamation;Complaint of Sh. Hamid Hussain, Incharge Telephone Centre Bilari against Bilari Mail, Bilari District Moradabad.;August 4, 1998;Upheld (Censured);AnnualReport1999;3069
3080;Press and Defamation;Complaint of Sh. S.C. Gupta, Director, Baron International Ltd., New Delhi against Mid-Day.;October 5, 1998;Upheld (Censured);AnnualReport1999;3080
3084;Press and Defamation;Complaint of Sh. T Sambi Reddy, Jagalmudi against Eenadu, Hyderabad.;October 5, 1998;Dismissed ;AnnualReport1999;3084
3085;Press and Defamation;Complaint of the President, ISKCON, Bangalore against Hai Bangalore.;October 5, 1998;Upheld (Censured);AnnualReport1999;3085
3086;Press and Defamation;Complaint of Sh. Prabhakar B Kore, Belgaum against Hai Belgavi, Belgaum (Karnataka);October 5, 1998;Upheld (Warned);AnnualReport1999;3086
3088;Press and Defamation;Complaint of Sh. Y Baburaju, Sub-Inspector, Police Station, Hadagali, Bellary, Karnataka against Editor Bellary Belagaithu, Bellary.;October 5, 1998;Dismissed on merits;AnnualReport1999;3088
3091;Press and Defamation;Complaint of Sh. Philipose Mathew, Reporter, Coffee Land Newspaper, Kodagu against Kodagu Ront.;October 5, 1998;Dismissed for lack of substance;AnnualReport1999;3091
3100;Press and Defamation;Complaint of Sh. Samasekhar Sundram, Junior Assistant Editor, The Times of India, Mumbai against Veto Power.;October  5,1998;Upheld;AnnualReport1999;3100
3101;Press and Defamation;Complaint of Sh. Samasekhar Sundram, Junior Assistant Editor, The Times of India, Mumbai against Mumbai Sandhya, Mumbai.;October  5,1998;Upheld;AnnualReport1999;3101
3103;Press and Defamation;Complaint of Shri O.P. Bharati against Saamna, Mumbai.;October 5, 1998;Upheld (Censured);AnnualReport1999;3103
3110;Press and Defamation;Complaint of Dr. (Mrs.) Uma Mishra, against Narmada Kesari, Hoshangabad.;October 5, 1998;Upheld (Censured);AnnualReport1999;3110
3112;Press and Defamation;Complaint of Prof. P.K. Gupta, Meerut against Amar Ujala, Meerut.;December 1, 1998;Upheld (Warned);AnnualReport1999;3112
3116;Press and Defamation;Complaint of Sh. R.S. Arora, Hon. Secretary, N.S.C.T. Mumbai against Mid-Day, Mumbai.;December 1, 1998;Upheld (Admonished);AnnualReport1999;3116
3119;Press and Defamation;Complaint of Ms. Sumita Singh, IAS, Administrator, HUDA, Faridabad against Public Asia.;December 1, 1998;To publish Rejoinder;AnnualReport1999;3119
3130;Press and Defamation;Complaint of Sh. V.K. Sharma,. Deputy General Manager, Tansen Hotel, Gwalior against Agradoot, Raipur.;December 1, 1998;Upheld (Admonished);AnnualReport1999;3130
3135;Press and Defamation;Complaint of Sardar Amar Jeet Singh against Amar Ujala, Meerut.;December 1, 1998;Upheld (Admonished);AnnualReport1999;3135
3142;Press and Defamation;Complaint of Sh. Anoop Kumar, Telecom District Engineer, Chhapra (Bihar) against Hindustan, Patna.;February 2, 1999;Upheld (Admonished);AnnualReport1999;3142
3146;Press and Defamation;Complaint of Smt. Manju Sharma, Correspondent, Aryavarta, Patna against Aryavarta.;February 2, 1999;Upheld (Admonished);AnnualReport1999;3146
3147;Press and Defamation;Complaint of Sh. S K Das, Secretary, ITC, Jalda (Rourkela) against The Samya, Bhubaneshwar.;February 2, 1999;Upheld;AnnualReport1999;3147
3148;Press and Defamation;Complaint of Sh. Manjul Bharati, Purnia against Aaj, Bihar edition.;February 2, 1999;Upheld (Warned);AnnualReport1999;3148
3150;Press and Defamation;Complaint of Sh. Suren Kumar Dash, IAS, Tahsildar District Bargarh (Orissa) against Nava Bharat, Raipur.;February 2, 1999;Settled;AnnualReport1999;3150
3153;Press and Defamation;Complaint of District Inspector of Schools, Sonepur against Pragatibadi, Bhubaneshwar.;February 2, 1999;Dismissed;AnnualReport1999;3153
3157;Press and Defamation;Complaint of Miss. Archana Nandi, Balasore against Matrubhasa;February 2, 1999;Upheld (Censured);AnnualReport1999;3157
3158;Press and Defamation;Complaint of Sh. SC Kakar, Bhubaneshwar against Prajatantra, Cuttack.;February 2, 1999;Upheld (Censured);AnnualReport1999;3158
3175;Press and Defamation;Complaint of Sh. Dinesh Jain, Vice President, Flex Group of Industries through his advocate against Public Asia.;February 2, 1999;Upheld (Censured);AnnualReport1999;3175
3176;Press and Defamation;Complaint of Smt. Rani, Kasganj, District Etha against Dainik Aaj, Agra.;February 2, 1999;Upheld (Censured);AnnualReport1999;3176
3190;Press and Morality;Suo-motu inquiry against The Asian Age, New Delhi dated January 25 & February 7, 1998 respectively.;October 5, 1998;Upheld (Censured);AnnualReport1999;3190
3191;Press and Morality;Suo-motu inquiry against Blitz for publishing obscene photograph in its issue dated June 14-20, 1997.;October 5, 1998;Upheld (Censured);AnnualReport1999;3191
3192;Press and Morality;Suo-motu inquiry initiated by Press Council of India against Blitz issue dated April 12-18, 1997.;October 5, 1998;Upheld (Admonished);AnnualReport1999;3192
3193;Press and Morality;Suo-motu inquiry by the Press Council of India against issue dated June 7-13, 1997 of Blitz, Mumbai.;October 5, 1998;Upheld (Warned);AnnualReport1999;3193
3194;Press and Morality;Suo-motu inquiry against The Asian Age, New Delhi issue dated 9.4.1998.;October 5, 1998;Settled ;AnnualReport1999;3194
3195;Press and Morality;Suo-motu inquiry against Indian Express issue dated 11.4.1998.;October 5, 1998;Upheld (Censured);AnnualReport1999;3195
3196;Press and Morality;Suo-motu inquiry against Jansatta, New Delhi issue dated 16.4.1998.;October 5, 1998;Settled;AnnualReport1999;3196
3197;Press and Morality;Complaint of Sh. M Asad, Mumbai against Mid-Day, Mumbai.;October 5, 1998;Upheld (Censured);AnnualReport1999;3197
3199;Press and Morality;Suo-motu action against Asian Age for publishing obscene photographs in the issue dated 12.10.98.;February2, 1999;Strong Disapproval;AnnualReport1999;3199
3203;Principles and Publication;Complaint of Shri Sudhir Ranjan Majumdar, M.P. (Rajya Sabha) against Dainik, Desher Katha, Agartala (Tripura).;June 23, 1997;Dropped -- complaint not actionable;AnnualReport1998;3203
3205;Principles and Publication;Complaint of Assam State Co-operative Agriculture & Rural Development Bank Ltd. against Asomiya Pratidin.;June 23, 1997;Dismissed on merits;AnnualReport1998;3205
3209;Principles and Publication;Complaint of Shri Umesh Chandra Saxena, Gandhidham against Sandesh, Rajkot.;June 23, 1997;Dismissed on merits;AnnualReport1998;3209
3216;Principles and Publication;Complaint of Shri P. Khanna, Director, National Environmental Engineering Research Institute, Nagpur against Down to Earth, New Delhi.;June 23, 1997;Upheld -disapproved with directions;AnnualReport1998;3216
3217;Principles and Publication;Complaint of Shri Chainsukh Sancheti, MLA, Maharashtra against Daily Deshonnati, Buldhana.;June 23, 1997;Dismissed on merits;AnnualReport1998;3217
3219;Principles and Publication;Complaint of Shri N.B. Deshpande, Nagpur against Tarun Bharat, Nagpur.;June 23, 1997;Upheld;AnnualReport1998;3219
3233;Principles and Publication;Complaint of M/s. Associated Brew-eries & Distilleries, Mumbai through M/s. Mahimtura & Co., Advocates, Mumbai against APLE NHAVE SHAHER, Mumbai.;June 23, 1997;Withdrawn;AnnualReport1998;3233
3234;Principles and Publication;Complaint of Shri M.S. Kilpady, Mumbai against Mid-Day.;June 23, 1997;Withdrawn;AnnualReport1998;3234
3235;Principles and Publication;Complaint of Shri George Pinto, M/s. Print India, Mumbai through his advocate Shri Prasanna Sarportdar against Mid-Day.;June 23, 1997;Disposed with directions;AnnualReport1998;3235
3236;Principles and Publication;Complaint of Shri K.R. Deshmukh, Secretary, Maharashtra State Service Commission, Mumbai against Loksatta, Mumbai.;June 23, 1997;Upheld (Reprimanded);AnnualReport1998;3236
3237;Principles and Publication;Complaint of Shri K.R. Deshmukh, Secretary, Maharashtra State Service Commission, Mumbai against Lokmat, Aurangabad.;June 23, 1997;Upheld (Reprimanded);AnnualReport1998;3237
3238;Principles and Publication;Complaint of Shri K.R. Deshmukh, Secretary, Maharashtra State Service Commission, Mumbai against Sakal, Pune.;June 23, 1997;Upheld (Reprimanded);AnnualReport1998;3238
3245;Principles and Publication;Complaint of Deputy Commissioner, Kulu against Himsatta, Chandigarh.;June 23, 1997;Upheld (Censured);AnnualReport1998;3245
3250;Principles and Publication;Complaint of Shri Brij Mohan, District Rewari against Punjab Kesari, Delhi.;June 23, 1997;Disposed on merits;AnnualReport1998;3250
3251;Principles and Publication;Complaint of Shri Vijay Kumar Arora, Advocate of Karnal against Punjab Kesari, Jalandhar.;June 23, 1997;Dismissed on merits;AnnualReport1998;3251
3255;Principles and Publication;Complaint of Shri A.C. Padhi, Joint Secretary, UPSC, New Delhi against Punjab Kesari, Delhi.;June 23,1997;Disposed of with directions;AnnualReport1998;3255
3256;Principles and Publication;Complaint of Major General Vombatkere, Additional Directorate General, Discipline & Vigilance, Adjutant General's Branch, Army Headquarter, DHQ, PO, New Delhi against The Week.;June 23,1997;Dropped (Regrets published);AnnualReport1998;3256
3260;Principles and Publication;Complaint of Shri V.K. Saxena, Brig., DDGMIL (C) Army Liaison Cell, New Delhi against India To-day.;June 23,1997;Disposed with directions;AnnualReport1998;3260
3264;Principles and Publication;Complaint of Shri Sukdeo Paswan, M.P. (Lok Sabha) (through his advocate Shri Prabhash Kumar Yadav) against Jansatta, New Delhi.;June 23,1997;Dismissed on merits;AnnualReport1998;3264
3283;Principles and Publication;Complaint of Shri Raj Kumar, Ex-MP (Lok Sabha) against Purvanchal Sandesh, Mau (U.P.).;September 22, 1997;Dismissed;AnnualReport1998;3283
3302;Principles and Publication;Complaint of Sardar Harmahender Singh Bagga, Hyderabad against Eenadu, Hyderabad.;September 22,1997;Dismissed on merits;AnnualReport1998;3302
3325;Principles and Publication;Complaint of Shri Prem Prakash Khurana of Chandausi against Chandausi Ki Udaan, U.P.;September 22,1997;Sub-judice;AnnualReport1998;3325
3326;Principles and Publication;Complaint of Shri K.K. Kulshrestha, Project Officer, Sarurpur (Meerut) against Sardhana Doon, Harra (Meerut).;September 22,1997;Dropped for lack of substance;AnnualReport1998;3326
3331;Principles and Publication;Suo-motu action regarding violation of the norms on identification of victim of assault by The Pioneer.;September 22,1997;Upheld;AnnualReport1998;3331
3333;Principles and Publication;Complaint of Distt. Collector/Dis-trict Electoral Officer, Mohoba against Dainik Amar Ujala, Agra.;September 22,1997;Sub-judice;AnnualReport1998;3333
3334;Principles and Publication;Complaint of Shri Rakesh Kumar Yadav, Lucknow against India To-day.;September 22,1997;Dismissed on merits;AnnualReport1998;3334
3336;Principles and Publication;Complaint of Shri Khaleefa Jasram, Joint Secretary, Wrestling Federa-tion of India, New Delhi against Jansatta, New Delhi.;September 22,1997;Dismissed on merits;AnnualReport1998;3336
3340;Principles and Publication;Complaint of Shri M.A. Mandana of Somwarpet, Distt. Kodagu, against Brahmagiri, Kodava weekly, Madikeri, Kodagu (Karnataka).;September 22, 1997;Contradiction directed.;AnnualReport1998;3340
3343;Principles and Publication;Complaint of Shri H.R. Channabasavaradhy, Secretary, VSSN Baraka Tumkur Distt. against Koratagere Vartha.;September 22, 1997;Dismissed for lack of substance;AnnualReport1998;3343
3344;Principles and Publication;Complaint of Shri H.R. Channabasavaradhy, Secretary, VSSN Baraka Tumkur Distt. against Prajapragathi.;September 22, 1997;Dismissed for lack of substance;AnnualReport1998;3344
3347;Principles and Publication;Complaint of Dr. V.M. Mirashi, Sangli against daily Marathi Pudhari, Kolhapur.;September 22,1997;Contradiction directed;AnnualReport1998;3347
3348;Principles and Publication;Complaint of Dr. V.M. Mirashi, Sangli against daily Marathi Pudhari, Kolhapur.;September 22,1997;Contradiction directed;AnnualReport1998;3348
3350;Principles and Publication;Complaint of M/s. Sanchayani Sav-ing & Investment (India) Ltd., against Shreeyogeshwar Manthan weekly, Burhanpur.;November 20, 1997;Sub-judice;AnnualReport1998;3350
3353;Principles and Publication;Complaint of Shri C.K. Mishra, IAS, Karimnagar, against Eenadu.;November 20, 1997;Disposed on merits;AnnualReport1998;3353
3355;Principles and Publication;Complaint of Shri S.C. Kakar, Managing Director, Orissa Drugs & Chemicals Ltd., Bhubaneshwar against Prajathantra, Cuttack.;November 20, 1997;Withdrawn;AnnualReport1998;3355
